{
  "$schema": "./release.schema.json",
  "schemaVersion": 2,
  "productVersion": "0.26.1",
  "baselineVersion": "0.20.0",
  "baselineRef": "fac533f154355a00e8bc1bb78112ec476ae68fef",
  "defaultBump": "minor",
  "candidateReplacements": [
    {
      "version": "0.24.0",
      "supersededCommit": "29cd44c662bc7b8577a85aedf5cd7e5e8aec67eb",
      "sourceCommit": "6192f1270e047d6cb525d700d1fcf2d86dbd3940",
      "approvedOn": "2026-09-21",
      "decision": "dokumentation/betrieb-und-deployment/RELEASE_0_24_KANDIDATENERSETZUNG.md"
    }
  ],
  "policy": {
    "policyVersion": 1,
    "effectiveFromVersion": "0.23.0",
    "tag": {
      "format": "vX.Y.Z",
      "signed": true,
      "annotated": true,
      "verifyBeforePublish": true,
      "immutable": true
    },
    "releaseCandidate": {
      "untilVersion": "1.0.0",
      "preferredLabel": "Release Candidate",
      "allowedAlternateLabel": "Proof of Concept",
      "githubPrerelease": true,
      "githubLatest": false,
      "titlePattern": "{version}-0 Release Candidate",
      "hotfixTitlePattern": "{version} Release Candidate"
    },
    "stable": {
      "firstVersion": "1.0.0",
      "automatic": false,
      "requiresExplicitAuthorization": true,
      "requiresDeploymentProfile": "target",
      "requiresVerifiedDeployment": true,
      "tagBeforeTargetBuild": true,
      "githubReleaseAfterVerifiedDeployment": true,
      "githubPrerelease": false,
      "githubLatest": true,
      "compactDisplayWhenPatchZero": true,
      "titlePattern": "Versorgungs-Kompass {displayVersion}: {theme}",
      "hotfixTitlePattern": "Versorgungs-Kompass {displayVersion} — Hotfix"
    },
    "cadence": {
      "weekly": {
        "weekday": "friday",
        "time": "09:17",
        "timeZone": "Europe/Berlin",
        "bump": "minor",
        "skipWithoutChanges": true
      },
      "hotfix": {
        "bump": "patch",
        "scheduled": false
      }
    },
    "documentation": {
      "weekly": {
        "theme": "required",
        "releaseNotes": "full",
        "changelog": "themed-release-section",
        "inAppHistory": true
      },
      "hotfix": {
        "theme": "forbidden",
        "releaseNotes": "compact",
        "changelog": "compact-item-under-current-minor",
        "inAppHistory": false,
        "carryIntoNextWeekly": true
      }
    },
    "deliveryChannels": [
      {
        "id": "pages-demo",
        "deploymentProfile": "pages-demo",
        "authMode": "anonymous-demo",
        "buildAuthority": "github-actions",
        "releaseTrigger": "product-release",
        "crossChannelPromotion": false
      },
      {
        "id": "private-gke",
        "deploymentProfile": "pre-gematik",
        "authMode": "iap",
        "buildAuthority": "github-actions-gke",
        "releaseTrigger": "manual-approval",
        "crossChannelPromotion": false
      },
      {
        "id": "gematik-target",
        "deploymentProfile": "target",
        "authMode": "oidc",
        "buildAuthority": "software-factory",
        "releaseTrigger": "controlled-release",
        "crossChannelPromotion": false
      }
    ],
    "handoff": {
      "source": "signed-git-tag",
      "destination": "gitlab-software-factory",
      "targetBuild": "fresh-from-tag",
      "requiredProof": [
        "tag-object-sha",
        "commit-sha",
        "signer-fingerprint",
        "tag-signature-verification",
        "target-artifact-digests"
      ],
      "forbiddenInputs": [
        "workspace-archive",
        "pages-artifacts",
        "private-gke-artifacts",
        "personal-values",
        "secrets",
        "data",
        "oidc-subjects"
      ]
    },
    "legacyTags": [
      "v0.21.0",
      "v0.22.0",
      "poc-v0.1.0-rc.2",
      "poc-v0.1.0-rc.3",
      "poc-v0.1.0-rc.4",
      "poc-v0.1.0-rc.5"
    ]
  }
}
